{
  "$schema": "https://json-schema.org/draft/2020-12/schema",
  "$id": "https://jev-planner.com/config.schema.json",
  "title": "jev-planner.json",
  "description": "A jev-planner run's settings. A flag given on the command line beats the key here. Never put an API key in this file: it is meant to be committed.",
  "type": "object",
  "additionalProperties": false,
  "properties": {
    "$schema": {
      "type": "string"
    },
    "agents": {
      "type": "object",
      "description": "The run's agents, in order, with their settings; {} selects one with none. As --agents. A provider's id selects that provider; any other key names another instance of one, with provider saying which.",
      "minProperties": 2,
      "propertyNames": {
        "pattern": "^[A-Za-z][A-Za-z0-9-]{0,23}$",
        "not": {
          "enum": [
            "auto",
            "none",
            "tie",
            "con",
            "prn",
            "aux",
            "nul",
            "com1",
            "com2",
            "com3",
            "com4",
            "com5",
            "com6",
            "com7",
            "com8",
            "com9",
            "lpt1",
            "lpt2",
            "lpt3",
            "lpt4",
            "lpt5",
            "lpt6",
            "lpt7",
            "lpt8",
            "lpt9"
          ]
        },
        "description": "An agent's name: a letter, then letters, digits or -, at most 24 characters, read lowercased; not a word the run reserves."
      },
      "properties": {
        "codex": {
          "type": "object",
          "additionalProperties": false,
          "properties": {
            "model": {
              "type": "string",
              "minLength": 1,
              "description": "The Codex model, as --model codex=<model> sets it."
            },
            "effort": {
              "type": "string",
              "minLength": 1,
              "description": "The reasoning effort, as --effort sets it."
            },
            "reviewEffort": {
              "type": "string",
              "minLength": 1,
              "description": "The effort for its cross-review and merge only, as --review-effort sets it."
            }
          }
        },
        "claude": {
          "type": "object",
          "additionalProperties": false,
          "properties": {
            "model": {
              "type": "string",
              "minLength": 1,
              "description": "The Claude model, as --model claude=<model> sets it."
            },
            "effort": {
              "type": "string",
              "minLength": 1,
              "description": "The reasoning effort, as --effort sets it."
            },
            "reviewEffort": {
              "type": "string",
              "minLength": 1,
              "description": "The effort for its cross-review and merge only, as --review-effort sets it."
            }
          }
        },
        "deepseek": {
          "type": "object",
          "additionalProperties": false,
          "properties": {
            "model": {
              "type": "string",
              "minLength": 1,
              "description": "The DeepSeek model, as --model deepseek=<model> sets it."
            }
          }
        },
        "kimi": {
          "type": "object",
          "additionalProperties": false,
          "properties": {
            "model": {
              "type": "string",
              "minLength": 1,
              "description": "The Kimi model, as --model kimi=<model> sets it."
            }
          }
        },
        "glm": {
          "type": "object",
          "additionalProperties": false,
          "properties": {
            "model": {
              "type": "string",
              "minLength": 1,
              "description": "The GLM model, as --model glm=<model> sets it."
            }
          }
        }
      },
      "additionalProperties": {
        "type": "object",
        "description": "A named agent, as --agents <provider>:<name> sets it.",
        "required": ["provider"],
        "additionalProperties": false,
        "properties": {
          "provider": {
            "enum": ["codex", "claude", "deepseek", "kimi", "glm"],
            "description": "The provider this agent runs on."
          },
          "model": {
            "type": "string",
            "minLength": 1,
            "description": "Its model, as --model <name>=<model> sets it."
          },
          "effort": {
            "type": "string",
            "minLength": 1,
            "description": "The reasoning effort, as --effort sets it; only for a provider that takes one."
          },
          "reviewEffort": {
            "type": "string",
            "minLength": 1,
            "description": "The effort for its cross-review and merge only, as --review-effort sets it."
          }
        },
        "if": {
          "properties": {
            "provider": {
              "enum": ["deepseek", "kimi", "glm"]
            }
          }
        },
        "then": {
          "properties": {
            "effort": false,
            "reviewEffort": false
          }
        }
      }
    },
    "mode": {
      "enum": ["fast", "balanced", "ultra"],
      "description": "As --mode."
    },
    "reviewMode": {
      "enum": ["standard", "debate"],
      "description": "As --review-mode."
    },
    "reviewRounds": {
      "enum": [0, 1, 2],
      "description": "As --review-rounds."
    },
    "claimChecks": {
      "type": "boolean",
      "description": "As --claim-checks."
    },
    "finalizer": {
      "type": "string",
      "minLength": 1,
      "description": "auto, none or one of the agents. As --finalizer."
    },
    "judgeModel": {
      "type": "string",
      "minLength": 1,
      "description": "As --judge-model."
    },
    "stragglerGrace": {
      "type": "number",
      "minimum": 0,
      "description": "Seconds. As --straggler-grace."
    },
    "timeout": {
      "type": "number",
      "exclusiveMinimum": 0,
      "description": "Seconds for each agent call. As --timeout."
    },
    "resume": {
      "type": "boolean",
      "description": "false as --no-resume."
    },
    "rounds": {
      "type": "boolean",
      "description": "false as --no-rounds."
    },
    "json": {
      "type": "boolean",
      "description": "As --json."
    },
    "verbose": {
      "type": "boolean",
      "description": "As --verbose."
    },
    "allowAnyTask": {
      "type": "boolean",
      "description": "As --allow-any-task."
    },
    "runsDir": {
      "type": "string",
      "minLength": 1,
      "description": "A folder in which each run gets its own timestamped folder. Relative to this file."
    },
    "output": {
      "type": "string",
      "minLength": 1,
      "description": "As --output. Relative to this file."
    },
    "cwd": {
      "type": "string",
      "minLength": 1,
      "description": "The repository to plan, as --cwd. Only in a file passed with --config. Relative to this file."
    },
    "task": {
      "type": "string",
      "minLength": 1,
      "description": "The coding task, used when none is given on the command line."
    },
    "taskFile": {
      "type": "string",
      "minLength": 1,
      "description": "A file holding the task, used when none is given on the command line. Relative to this file."
    }
  },
  "not": {
    "anyOf": [
      {
        "required": ["task", "taskFile"]
      },
      {
        "required": ["runsDir", "rounds"],
        "properties": {
          "rounds": {
            "const": false
          }
        }
      }
    ]
  }
}
