{
  "$schema": "./packages/jev-planner/config.schema.json",
  "agents": {
    "fable": { "provider": "claude", "model": "claude-fable-5-1", "effort": "xhigh" },
    "opus": { "provider": "claude", "model": "claude-opus-5", "effort": "xhigh" },
    "sol": { "provider": "codex", "model": "gpt-5.6-sol", "effort": "high" }
  },
  "mode": "ultra",
  "reviewMode": "debate",
  "claimChecks": true,
  "verbose": true
}
